contact_id,municipality_id,entity_type,name,title,role_normalized,role_family,department,department_normalized,email,email_type,phone,phone_ext,address,hours,page_type,source_url,display_confidence,is_likely_noise,rn
ctc_fd1e2b4f515a197d2cf2,ct_middlefield,role,,Anne L. Olszewski Tax Collector Email Anne L. Olszewski Phone: 860-349-7117,Tax Collector,tax_collector,Anne L. Olszewski Tax Collector Email Anne L. Olszewski Phone,Tax Collector,tax1@middlefieldct.org,role_based,8603497117,,"393 Jackson Hill Road P.O Box 179 Middlefield, CT 06455 Phone: 860-349-7114 Quick Links Building and","Create a Website Account - Manage notification subscriptions, save form progress and more. Website Sign In Search Government Community Services Resources How Do I... Home Government Town Offices Tax Collector Tax Collector Online Payment Convenience Fees 2.5% Master Card, VISA, Discover, or American Express; $2.00 ACH/EFT check. Please Note: As with all tax payments, your payment is recorded as PAID for Interest and Date of Payment purposes on the date it is paid in our database. Your payment is not successfully completed until the funds are transferred into the Town of Middlefield’s bank account. If a payment is returned for any reason there will be a return payment fee of $20.00 and any additional interest will be owed. Motor Vehicles will be cleared by the DMV five business days after payment is made on this site. If you need an immediate release from DMV, you must come in (see business hours to the right) and pay with cash or a bank check. View the My Tax Bill website to look up and or pay your tax online. Facts Concerning Taxes Mill Rate The current Mill Rate for the 2024 Grand List is 29.80. A mill is equal to 1/1000 of a dollar. The mill rate is typically set in May when the budget is passed. General Billing Information Tax bills are mailed out once a year on June 30. Your bill will have 3 parts: one for your records, one for July's payment, and one for January's payment. No reminder bills are sent. Delinquent interest accrues as of the due date with interest charged monthly @ 1.5% of the unpaid taxes, with a $2 minimum. Due Dates: Real Estate and Personal Property Bills: Middlefield has set due dates for Real Estate and Personal Property bills (if over $100), to be divided in two equal halves - July 1 and January 1. (Technically taxes are due and payable in full on July 1 (§7 - 383). However, §12 - 142 allows the Legislative Body for Middlefield (Town Meeting) to set the due dates for taxes.) Motor Vehicle Bills: Taxes are due in full - July 1. ""Motor Vehicle Supplement Bills"" (for vehicles registered after October 1) due in full - January 1. (These dates were set in the Middlefield Town Code of Ordinance, Chapter 13, Article 1, Sec. 13 - 14a.) There is a 30 - day grace period to pay without penalty. Assessment Middlefield's Tax Collector and Tax Assessor are bound by the Connecticut General State Statutes. The statutes that apply to tax assessment and collection can be found in Volume 4, Section 12 of the State Statutes. Real Estate taxes are based on 70% of the Fair Market Value as of the last State - ­mandated town - wide revaluation. The next revaluation for Middlefield is for the Grand List of 2026. Exemptions Military and senior exemptions are processed and approved through the Assessor's Office in order for an exemption to be applied to your tax bill. Contact Us Anne L. Olszewski Tax Collector Email Anne L. Olszewski Phone: 860 - 349 - 7117 Tax Collector Phone: 860 - 349 - 7117 Regular Hours Monday through Friday 9 am to 1:30 pm January & July Hours (Tax Collecting Months) Monday 9 am to 5 pm Tuesday through Thursday 9 am to 4 pm Friday 9 am to 3 pm Directory FAQs How can I pay my tax bill? I need a receipt, what do I do? When is the last day to pay? View All /FAQ.aspx Assessor Motor Vehicles Veterans Exemptions Renters Rebate Program Elderly and Totally Disabled Homeowners Program Legally Blind and Totally Disabled Exemptions Personal Property Personal Property Forms Emergency Services Finance First Selectman Proclamations Health Department Building & Land Use Affordable Housing Plan Inland Wetlands Planning & Zoning Zoning Board of Appeals Parks & Recreation Programs Middlefield Summer Camp 2026 Hours, Costs, Dates Safety and Inclusion Information Camper Ages and Eligibility After School Enrichment Parks Lake Beseck Beach Parks & Recreation Boards & Commissions Rental of Fields, Courts, and Pavilion Parks and Recreation Employment Summer Camp CIT Program Summer Camp Employment Lake Beseck Waterfront Staff Program Instructors Public Works Registrar of Voters Senior Programs & Services Informational Links for Seniors Medication / Drug Disposal Senior Lunch Programs & Meals on Wheels Transportation Veterans Services & Resources Social Services Department Energy Assistance Tax Collector Town Clerk Absentee Ballot Application Dog Licenses Fish & Game Licenses Freedom of Information Land Records Liquor Licenses Military Tax Exemptions Notary Public Services Trade Name Certificate Vital Records - Births / Marriages / Deaths Treasurer Agendas & Minutes Facilities Forms Notify Me® Contact Us Town of Middlefield 393 Jackson Hill Road P.O. Box 179 Middlefield, CT 06455 Phone: 860 - 349 - 7114 Quick Links Building and Land Use Permits website Search Land Records Pay Tax Bills GIS Maps Emergency Services /QuickLinks.aspx Quick Links Home Site Map Contact Us Accessibility Copyright Notices Privacy Policy /QuickLinks.aspx Government Websites by CivicPlus®",department_page,https://www.middlefieldct.org/186/Tax-Collector,1.0,0,1
ctc_303b91550a8f71833642,ct_middlefield,person,of Vital Statistics,Town Clerk,Town Clerk,town_clerk,"Kim Garvis Assistant Town Clerk, Assistant Registrar of Vital Statistics Email Kim Garvis",Town Clerk,kgarvis@middlefieldct.org,direct,8603497116,,"393 Jackson Hill Road P.O Box 179 Middlefield, CT 06455 Phone: 860-349-7114 Quick Links Building and","Create a Website Account - Manage notification subscriptions, save form progress and more. Website Sign In Search Government Community Services Resources How Do I... Home Government Town Offices Town Clerk Town Clerk The Town Clerk’s Office offers a variety of services. We provide official information between local government and the public. We are the “keeper” of Town Records. We also work closely with legislative bodies on recording and maintaining official records and documents. From reproducing birth, death and marriage certificates, to licensing your dog, to receiving the agendas and/or minutes of boards and commissions, to finding out who is running for election, the Town Clerk’s office is here to assist all in the most pleasant and helpful way possible. NEW!! Marriage License Kiosk Marriage licenses must be obtained in the town where the marriage ceremony is taking place. There are no premarital blood tests required. Marriage licenses will be issued Monday through Friday. Complete your Marriage License application online and submit it electronically to the town clerks office by visiting the Marriage License Kiosk Website . Once you submit the application, p lease call 860 - 349 - 7116 to schedule an appointment to complete the process. . Prevent Land Record Fraud Learn more and sign up online for our complimentary Property Alert Service . View the Town of Middlefield’s Land Record Search website . Middlefield Cemetery Plot Listing Take a look at the comprehensive list of plots in the Middlefield Cemetery Index (PDF) Contact Us Town Clerk Phone: 860 - 349 - 7116 Hours Monday 9 am to 5 pm Tuesday, Wednesday and Thursday 9 am to 4 pm Friday 9 am to 12 pm After Hours By Appointment Directory Tonya Hogan CCTC, Town Clerk, Registrar of Vital Statistics Email Tonya Hogan Phone: 860 - 349 - 7116 Kim Garvis Assistant Town Clerk, Assistant Registrar of Vital Statistics Email Kim Garvis Absentee Ballot Application Dog Licenses Fish & Game Licenses Freedom of Information Land Records Liquor Licenses Military Tax Exemptions Notary Public Services Trade Name Certificate Vital Records - Births / Marriages / Deaths Agendas & Minutes Facilities Forms Notify Me® Contact Us Town of Middlefield 393 Jackson Hill Road P.O. Box 179 Middlefield, CT 06455 Phone: 860 - 349 - 7114 Quick Links Building and Land Use Permits website Search Land Records Pay Tax Bills GIS Maps Emergency Services /QuickLinks.aspx Quick Links Home Site Map Contact Us Accessibility Copyright Notices Privacy Policy /QuickLinks.aspx Government Websites by CivicPlus®",department_page,https://www.middlefieldct.org/216/Town-Clerk,1.0,0,1
ctc_a56423414a3908631769,ct_middlefield,person,Financial Director,Town Treasurer,Treasurer,finance,,Finance,,unknown,8603497112,,393 Jackson Hill Road,,staff_directory,https://www.middlefieldct.org/Directory.aspx?did=12,1.0,0,1
ctc_3929baadd159d0494cc6,ct_old_lyme,person,American Rescue,Assessor,Assessor,assessor,American Rescue Plan Committee Assessor Board of Assessment Appeals,Assessor,,unknown,8604341605,219,52 Lyme Street,Hours: Monday - Friday 9:00am to 4:00pm,staff_directory,https://www.oldlyme-ct.gov/Directory.aspx,1.0,0,1
ctc_4545231aa3bee5831ecc,ct_old_lyme,person,Adminstrative Assistant,Building Official,Building Official,building,,Building,ghoude@oldlyme-ct.gov,direct,8604341605,213,"213 More Information Building Contact the Building Department Physical Address 52 Lyme Street Old Lyme, CT 06371 Phone: 860-434-1605, ext 230 Directory Glynis Houde Admins","Home Town Departments Building Building Building Department Administrative Office hours: Monday - Friday 9:00am - 1:00pm (please call between these hours to schedule inspections) Responsibilities The Building Department issues all permits for residential and commercial construction, including structural, plumbing, mechanical, electrical, gas, supplemental heaters, and temporary tents. Inspections of all phases of permitted work is scheduled through the building department’s administrative assistant. Upon completion of work, the Building Department will issue a certificate of occupancy if applicable. The Building Department will answer code - related questions, enforce the State of Connecticut Building statutes and currently adopted codes, receive building complaints, and stop work orders if necessary. Building Code The 2020 Connecticut State Building Code is based on the International Code Council’s widely - adopted 2021 International Codes and references the ICC A117.1 - 2009 standard for accessibility, and applies to projects with permit applications filed from October 1, 2022. Building Permit Applications Building permit applications are available online via our Building and Zoning portal . Building Records All Building records before January 1, 2020, are available in paper files at the Town Hall. To search records after January 1, 2020, see our Public Records Search website . Contact Us Mark Wayland Building Official Contact Mark Wayland Phone: 860 - 434 - 1605, ext. 213 More Information Building Contact the Building Department Physical Address 52 Lyme Street Old Lyme, CT 06371 Phone: 860 - 434 - 1605, ext. 230 Directory Glynis Houde Adminstrative Assistant Email Phone: 860 434 1605 Ext. 230 More Information Building Forms & Documents Building Permit Applications Building Permit Records Search as of January 1, 2020 Deck Construction Guide (PDF) GIS Mapping Request for Modification of the State Building Code (PDF) Swimming Pool Barrier Guide (PDF) Town Ordinances",department_page,https://www.oldlyme-ct.gov/176/Building,1.0,0,1
ctc_8a6962df47aaa74392b5,ct_old_lyme,role,,Assistant to the Finance Director,Finance Director,finance,,Finance,,unknown,8604341605,215,52 Lyme Street Old Lyme CT 06371,Hours Monday through Friday 9 am to 4 pm,staff_directory,https://www.oldlyme-ct.gov/Directory.aspx?did=10,1.0,0,1
ctc_67ca984f02af5ddbad68,ct_old_lyme,role,,First Selectman,First Selectman,chief_executive,,,amancini@oldlyme-ct.gov,direct,8604341605,212,"1605 ext 212 More Information Board of Finance Contact Board of Finance Physical Address 52 Lyme Street Old Lyme Memorial Town Hall Old Lyme, CT 06371 Phone: 860-434-1605, ext 212 D","Town Departments Boards & Commissions Explore Old Lyme How Do I... Search Home Boards & Commissions Board of Finance Board of Finance 2026 Annual Town Meetings Annual Town Business Meeting: January 26, 2026 Annual Town Budget Public Hearing: April 20, 2026 Annual Town Budget Meeting : May 18, 2026 Regularly Scheduled 2026 Meeting List Meetings 7:00PM on the 3 rd Tuesday of the month April - January (*Oct 14 - 2 nd Tuesday due to Early Voting) Budget Meetings February 4, 11 & 25 March 4, 11, 18 & 25 You will find the Proposed Budget for 2026 - 2027 here in April. Agendas & Minutes View the Most Recent Agendas & Minutes Contact Us Michele Hayes Office Manager - First Selectman's Office Contact Michele Hayes Phone: 860 - 434 - 1605 ext. 212 More Information Board of Finance Contact Board of Finance Physical Address 52 Lyme Street Old Lyme Memorial Town Hall Old Lyme, CT 06371 Phone: 860 - 434 - 1605, ext. 212 Directory Anita Mancini Finance Director Contact Anita Mancini Phone: 860 - 434 - 1605 ext. 232 More Information Annual Report Audits Finance Office Town Ordinances Annual Town Budget & Annual Town Budget Meeting Information Meetings Agendas, Minutes & Recordings Permits & Licenses Learn more about permitting and licensing Trash & Recycling Learn more about trash and recycling in your area Parks & Recreation Learn more about parks and recreation GIS Land Maps Learn more about GIS mapping Notify Me® Stay up to date with Old Lyme Contact Us Town of Old Lyme 52 Lyme Street Old Lyme, CT 06371 Phone: 860 - 434 - 1605 Hours: Monday - Friday 9:00am to 4:00pm Quick Links Photo Credits Permits & Licenses Trash & Recycling Town Clerk Town Ordinances Notify Me /QuickLinks.aspx Site Links Home Site Map Contact Us Accessibility Copyright Notices Privacy Policy Employee Portal /QuickLinks.aspx Government Websites by CivicPlus®",board_page,https://www.oldlyme-ct.gov/325/Board-of-Finance,1.0,0,1
ctc_3cf9043cbd624091fbd6,ct_old_lyme,person,Land Use,,Land Use,planning_zoning,Land Use Open Space Commission Parks & Recreation,Land Use,,unknown,8604341605,,52 Lyme Street,Hours: Monday - Friday 9:00am to 4:00pm,staff_directory,https://www.oldlyme-ct.gov/Directory.aspx,1.0,0,1
ctc_77951839c98d5d7f035b,ct_old_lyme,person,Land Use,,Planner,planning_zoning,Zoning,Planning & Zoning,,unknown,8604341605,236,52 Lyme Street,Hours: Monday - Friday 9:00am to 4:00pm,department_page,https://www.oldlyme-ct.gov/213/Land-Use-Zoning,1.0,0,1
ctc_68906c72cc53a8a39a7d,ct_old_lyme,role,,Tax Collector,Tax Collector,tax_collector,Suzanne Thompson Tax Collector Contact Suzanne Thompson More Information,Tax Collector,sthompson@oldlyme-ct.gov,direct,8604341400,,"52 Lyme Street Old Lyme, CT 06371 Fax: 860-434-1400 Directory Mill Rate ​The mill rate for th","Town Departments Boards & Commissions Explore Old Lyme How Do I... Search Home Town Departments Tax Collector Tax Collector Second installment payments of Real Estate and Personal Property Taxes were due January 1 and delinquent after Monday, February 2, 2026 . Grand Year List 2024 Supplemental Motor Vehicle Taxes also were due at that time. The Supplemental bills are for vehicles registered or registrations transferred to a new vehicle after October 1, 2024. Those new bills were mailed in mid - December and are available online through our webpage for payment. Remember, if you no longer have a vehicle, please contact Old Lyme Assesso r for a possible Motor Vehicle Adjustment that could reduce your taxes before you send us your payment. Real Estate & Personal Property Taxes We do not mail taxpayers a December reminder for 2 nd installment of Real Estate or Personal Property taxes. You received your 2 nd installment payment coupon in late June 2025. Replacement coupons can be printed from our website, see How to Check Payment Status and Print Duplicate Payment Coupons below. Mortgage Escrow Accounts If you paid off your Mortgage in recent months and no longer have your Real Estate property taxes paid through an Escrow Account, it is your responsibility to make the 2 nd installment payment. We do not mail you a reminder of the 2 nd payment for your January payment. If you cannot find your account on our webpage, please contact us. We always accept partial payments of taxes due once a Tax Year has started in July. NOTICE: If you are paying a Delinquent Motor Vehicle tax and are seeking a quick release of our CT DMV hold, please bring exact cash payment to our office. If you pay Delinquent MV taxes through our portal, we cannot release your CT DMV hold for a minimum of 48 hours for Credit Card payments to clear. Debit Card and ACH (eChecks) can take up to 5 days for the funds to clear and for us to release you. Use these buttons to take you to our tax payment portal. If you make an online payment through our portal, please note that it will not be reflected on our website for at least 48 hours. Please retain your confirmation receipt from your credit/debit card or e - Check payment. Please confirm with your financial institution that the funds have been taken out of your account before calling us. Online Payment Fees: Credit card fee 2.5% (minimum fee of $2.00) Debit card fee 1.0% (minimum fee of $2.00) ACH (electronic) e - Check fee $0.95 (ninety - five cents) How to Check Payment Status and Print Duplicate Payment Coupons To print out copies of your original tax bill and to track our processing of your payment please click on the Check Payment Status tab and follow the prompts. To print the original tax bill and coupons that were mailed in June 2025, please click on the red and white rectangular icon. If you either overpaid or underpaid any taxes, you can find the updated amounts by clicking on the round blue “i” for a Tax Information statement that shows these. Scroll to the bottom of the page and select “Save as PDF” to print out a copy. If you see a green shopping cart on the right - hand side, you owe taxes. Click on the green shopping cart to pay online. Then scroll to the top, click on the gold shopping cart bar to check out and complete payment. All set with CT Department of Motor Vehicles (DMV)? CT DMV will not process motor vehicle or boat registrations if you have delinquent Motor Vehicle taxes. We need at least 48 hours to release credit/debit card payments and checks need to clear before we can release vehicles. And sometimes there are computer glitches between CT DMV and our tax system. Before you make a DMV appointment or mail DMV your registration fee, please use this CT DMV Compliance portal to see if CT DMV reflects that you have been cleared by Town of Old Lyme. Please call us if your taxes are paid up but you get a hold flag! CT DMV Check for Compliance Responsibilities The Tax Collector is responsible for the collection of all monies due to the Town including, but not limited to: Real Estate Taxes Motor Vehicle Taxes Personal Property Taxes The Collector is also responsible for reporting fiscal information to the various Town Departments, Boards and Commissions, the State of Connecticut, and the United States Bureau of the Census. Contact Us Suzanne Thompson Tax Collector Contact Suzanne Thompson More Information Tom Correia Tax Assistant Contact Tax Assistant More Information Tax Collector Contact the Tax Collector Department Physical Address 52 Lyme Street Old Lyme, CT 06371 Fax: 860 - 434 - 1400 Directory Mill Rate ​The mill rate for the 2024 Grand List for Real Estate, Personal Property and Motor Vehicles is 16.23 .​ Motor Vehicle taxes were due July 1, 2025 (delinquent after 8/1/2025) Real Estate & Personal Property bills over $100 may be paid in 2 installments: July 1, 2025 ​(delinquent after 8/1/2025) and January 1, 2026 (delinquent after 2/2/2026) Motor Vehicle Supplemental taxes were due January 1, 2026 (delinquent after 2/2/2026) Delinquent tax or installments are charged interest of one and one half percent (1.5%) per month or 18% per year. Interest rates, dates and charges are set by Connecticut state law, CGS 12 - 146. Partial payments are always accepted. Online Services Search Tax Bills Online Tax Office Legal & Public Notices Frequently Asked Question (FAQ) COLLECTIONS of DELINQUENT TAXES - TaxServ Meetings Agendas, Minutes & Recordings Permits & Licenses Learn more about permitting and licensing Trash & Recycling Learn more about trash and recycling in your area Parks & Recreation Learn more about parks and recreation GIS Land Maps Learn more about GIS mapping Notify Me® Stay up to date with Old Lyme Contact Us Town of Old Lyme 52 Lyme Street Old Lyme, CT 06371 Phone: 860 - 434 - 1605 Hours: Monday - Friday 9:00am to 4:00pm Quick Links Photo Credits Permits & Licenses Trash & Recycling Town Clerk Town Ordinances Notify Me /QuickLinks.aspx Site Links Home Site Map Contact Us Accessibility Copyright Notices Privacy Policy Employee Portal /QuickLinks.aspx Government Websites by CivicPlus®",department_page,https://www.oldlyme-ct.gov/245/Tax-Collector,1.0,0,1
ctc_92116cd40024af63fe64,ct_old_lyme,person,Land Use,Town Clerk,Town Clerk,town_clerk,Zoning,Planning & Zoning,jcarlos@oldlyme-ct.gov,direct,8604341605,225,"1605 Ext 234 More Information Land Use Contact the Land Use Department Physical Address 52 Lyme Street Old Lyme, CT 06371 Directory Related Documents Land Use Fee Schedules Old Lyme","Town Departments Boards & Commissions Explore Old Lyme How Do I... Search Home Town Departments Land Use & Zoning Land Use & Zoning Old Lyme has been continuously settled for more than 350 years. The use of land in Old Lyme must balance the historic nature of the town against the needs of its present residents and the challenges of a changing climate. All permits are now online. Please use our online permitting site . The Land Use Department encompasses three basic areas: Zoning. For items meeting the Zoning Regulations, this is mostly handled by our online administrative permit program, which is linked to below. For items that require approval from the Zoning Commission, such as Special Permits and Site Plans, permits must be downloaded and submitted. Those forms are linked to below. For items that would not meet the Regulations, due to encroaching on setbacks or exceeding coverage or including a use not otherwise allowed in the zone, a variance may be sought from the Zoning Board of Appeals. That form is included below as well. Planning. The Planning Commission reviews the division of land in Old Lyme. For properties that have not been divided since April 1, 1958 and are being split from one piece into two pieces, please use the Original Division application attached below. For properties that have already been divided or are being divided into three or more parcels, this requires a Subdivision Application, attached below. Inland Wetlands and Watercourse. Any work to be performed within 100' of an inland wetland (natural or man - made) or a watercourse, requires permission from the Inland Wetlands and Watercourses Commission. That application is attached below. Note: there is a distinction between inland wetlands and tidal wetlands. Activities involving tidal wetlands are regulated by the Zoning Commission. If you are uncertain if wetlands are inland or tidal, please contact this office or have a soil scientist review the site. Application Forms Special Permit Application with Instructions Residential Variance Application Guide Variance Application Form with Instructions Inland Wetlands and Watercoures Application (PDF) Original Division Application (PDF) Municipal Coastal Site Plan Review for Projects Located Within Coastal Boundary (PDF) Application for Subdivision (PDF) ZEO Appeal Form with Instructions - effective May 1 2023 Lot Line Modification (PDF) Surveyor Certificate Engineering & Surveyor List Old Lyme Zoning Rewrite Project Old Lyme Zoning Rewrite Project Contact Us Eric Knapp Land Use Coordinator Contact Eric Knapp Phone: 860 - 434 - 1605, ext. 225 More Information Craig Bonatti Land Use Technician (Zoning, ZBA) Contact Craig Bonatti Phone: 860 - 434 - 1605, ext. 236 More Information Julie Michell Land Use Technician (Planning, Inland Wetland) Contact Julie Michell Phone: 860 - 434 - 1605 Ext. 234 More Information Land Use Contact the Land Use Department Physical Address 52 Lyme Street Old Lyme, CT 06371 Directory Related Documents Land Use Fee Schedules Old Lyme Design Standards (PDF) Guide to Low Impact Development (PDF) OldLyme_ZoningMap (002) Coastal Property Owner Brochure 2021 Coastal Property Owners Guide Building Department Old Lyme Zoning Regulations Rewrite Land Use Regulations Land Use Boards Inland Wetlands Commission Planning Commission Zoning Board of Appeals Zoning Commission Check your Septic Tank System Pump Out History Meetings Agendas, Minutes & Recordings Permits & Licenses Learn more about permitting and licensing Trash & Recycling Learn more about trash and recycling in your area Parks & Recreation Learn more about parks and recreation GIS Land Maps Learn more about GIS mapping Notify Me® Stay up to date with Old Lyme Contact Us Town of Old Lyme 52 Lyme Street Old Lyme, CT 06371 Phone: 860 - 434 - 1605 Hours: Monday - Friday 9:00am to 4:00pm Quick Links Photo Credits Permits & Licenses Trash & Recycling Town Clerk Town Ordinances Notify Me /QuickLinks.aspx Site Links Home Site Map Contact Us Accessibility Copyright Notices Privacy Policy Employee Portal /QuickLinks.aspx Government Websites by CivicPlus®",department_page,https://www.oldlyme-ct.gov/213/Land-Use-Zoning,1.0,0,1
ctc_84f938622018818b2f15,ct_roxbury,role,,Assessor (860) 354-2634,Assessor,assessor,Assessor,Assessor,,unknown,8603542634,,29 North Street,,staff_directory,https://www.roxburyct.com/Directory.aspx,1.0,0,1
