contact_id,municipality_id,entity_type,name,title,role_normalized,role_family,department,department_normalized,email,email_type,phone,phone_ext,address,hours,page_type,source_url,display_confidence,is_likely_noise,rn
ctc_f29fc65999b9b5dd3f49,ct_bristol,person,Deputy Tax,Deputy Tax Collector,Tax Collector,tax_collector,Deputy Tax Collector Office Ph: MAIL PAYMENTS TO: TAX COLLECTOR,Tax Collector,taxoffice@bristolct.gov,role_based,8605846270,,"111 North Main Street Bristol, CT 06010 Phone: 860-584-6270 Staff Directory Helpful Links About Our D","Search I Want To... Discover Bristol Services Business Departments Facebook Twitter Pinterest Delicious Blogger LinkedIn Home My Account Printer Friendly Email Page Contact Us RSS Site Map Translate Page Notifications Documents Home Departments Tax Office About Us About Us CITY HALL The City has implemented new hours effective November 27, 2023: Monday - Thursday 8:00 am to 4:30 pm Friday 8:00 am to 1:30 pm RESPONSIBILITIES Welcome to the Bristol Tax Office. The Tax Collector’s Office has the responsibility of collecting revenue generated from the annual Grand List which consists of Real Estate, Motor Vehicle, and Personal Property taxes. Department responsibilities and procedures are strictly governed by the Connecticut General Statutes in conjunction with the Office of Policy and Management and the City ordinances. Balancing the need to maintain a high rate of collection with the sensitivity necessary to deal with individual taxpayer issues, especially in difficult economic times, is an integral function of the department. NEW: DMV no longer accepts paper clearances. If you fail to pay your taxes on time and allow them to become delinquent, it will take between 48 and 72 hours for your name to be cleared at DMV via electronic file. You will NOT be able to register/renew on the same day you pay delinquent taxes. DO NOT WAIT UNTIL LAST MINUTE TO PAY YOUR DELINQUENT TAXES. PLEASE PLAN ACCORDINGLY! SPECIFICALLY: A list of people who pay with cash by noon will be submitted to DMV via electronic file that evening and will be cleared to register the next business day. If you pay after noon, or any time of day with a credit card, you will be cleared to register at least 48 hours later. *** ***Of course, if you pay with a credit card on Friday, you will not be able to conduct business at DMV until Tuesday. Whether you pay electronically or with a paper check, if your payment is returned unpaid by the bank, you will be charged a $20 returned payment fee. If your vehicle was sold, stolen, totaled, or you are being billed for property you no longer own, please visit the Assessor’s Office . You may be entitled to a refund or adjustment to your bill. For Water/Sewer information, please call the Water Department at 860 - 582 - 7431. Bristol has NO FIRE DISTRICTS. Current Grand List Tax Information Change of Address Form Make a Payment General Tax Information Payment Dates Contact Us Ann V. Bednaz, CCMC Tax Collector Jennifer S. Cole, CCMC Deputy Tax Collector Office Ph: (860) 584 - 6270 TAXOFFICE@BRISTOLCT.GOV MAIL PAYMENTS TO: TAX COLLECTOR CITY OF BRISTOL PO BOX 1040 BRISTOL, CT 06011 - 1040 THE CITY HAS IMPLEMENTED NEW HOURS EFFECTIVE NOVEMBER 27, 2023: NEW HOURS: monday - thursday 8:00 am - 4:30 pm friday - 8:00 am - 1:30 pm HOLIDAY CLOSURE: MAY 25, 2026 JUNE 19, 2026 JULY 3, 2026 September 7, 2026 FAQs How is my tax calculated? What is the new mill rate? When is the tax bill due? View All /FAQ.aspx About Us General Tax Information Payment Dates Make a Payment MAKE A PAYMENT CHANGE OF ADDRESS PAYMENT DATES GENERAL TAX INFO. CURRENT GRAND LIST TAX INFO. FAQS Contact Us 111 North Main Street Bristol, CT 06010 Phone: 860 - 584 - 6270 Staff Directory Helpful Links About Our Department Tax Office Online Payments Events/Attractions/Places to Eat & Stay Police /QuickLinks.aspx Using This Site Home Accessibility Privacy Copyright Notices Staff Directory Government Websites by CivicPlus® /QuickLinks.aspx",other,https://www.bristolct.gov/656/About-Us,1.0,0,1
ctc_d2ebf51f0fcef116d2f0,ct_bristol,role,,Town Clerk (860) 584-6200,Town Clerk,town_clerk,Town Clerk,Town Clerk,,unknown,8605846200,,111 North Main Street,,staff_directory,https://www.bristolct.gov/directory.aspx,1.0,0,1
ctc_845b4b53be80bf6f7ec9,ct_bristol,role,,Treasurer (860) 584-6285,Treasurer,finance,Treasurer,Finance,,unknown,8605846285,,111 North Main Street,,staff_directory,https://www.bristolct.gov/directory.aspx,1.0,0,1
ctc_986e38ebe1f1e12d1a03,ct_clinton,role,,Assessor's Office 860-669-9269,Assessor,assessor,Assessor's Office,Assessor,,unknown,8606699269,,54 E Main Street,Town of Clinton Hours and Holidays,staff_directory,https://clintonct.org/Directory.aspx,1.0,0,1
ctc_f7e162c91e91697e7969,ct_clinton,role,,Building Official,Building Official,building,Jocelyn Bulduc Clerk Email,Jocelyn Bulduc Clerk Email,jbulduc@clintonct.org,direct,8606699118,,"54 E Main Street Clinton, CT 06413 Phone: 860-669-9118 Hours Monday - Wednesday 9 a.m - 4 p.m","Home Departments Building Department Building Department Introduction Clinton’s Building Official receives building permit applications, reviews building and site plans, directs the applicant to other agencies, answers questions on the building process and works to protect the Town and the public’s general health, safety and welfare. The Building Department is responsible for monitoring all building activities in Town through the issuance of permits and inspections for all new and renovated buildings, electrical, plumbing, heating, air conditioning, demolitions and gas & oil tank installations/removals. Department files are coded and digitally recorded on the Docuphase document management system for future reference. This department is regulated by State Statutes and a close working relationship is maintained with the Fire Marshal’s Office. Online Building Permit System For the convenience of both property owners and contractors, the Town of Clinton employs an online permit system which is accessible below. Using the system, you may apply for a building or trade permit, attach supporting documents and/or check the status of a permit. Documentation required for permitting, can be viewed in the permit system by using the Apply for a Permit link below. All applications for the Building Department require COI/Workman’s Comp Affidavit and Contractor’s License to be submitted for every job. Miscellaneous information is located as links at the bottom of this page. Paying by credit card online is preferred, for a quicker and smoother process, however, we accept checks or cash, in person or by mail. Applications will not be reviewed until all required documents and fees are submitted. Fee schedule below. AS OF JANUARY 1, 2025, PER THE BUILDING OFFICIAL RICHARD PLEINES, ALL PROJECTS REQUIRE SEPARATE MECHANICAL PERMITS (ELECTRIC, PLUMBING, HEATING) WITH THEIR OWN COST OF CONSTRUCTION VALUE. BUILDING PERMITS SHOULD ONLY COVER FOUNDATIONS, FRAMING, WINDOWS, DOORS, INSULATION, ETC. PLEASE CALL THE OFFICE IF YOU HAVE ANY QUESTIONS PRIOR TO PAYING FEES. Apply for a Permit/ Permit Status/ Building Permits as of June 23, 2022 - Click Here Fees and Office Policies - Fees and Office Policies Research Property Files - Click Here Inspections/Final CO Requirements - Click Here As - Built Map Requirements - Click Here Unpermitted Work - Click Here Contact Us Richard Pleines Building Inspector Email Jocelyn Bulduc Clerk Email Building Department Physical Address 54 E Main Street Clinton, CT 06413 Phone: 860 - 669 - 9118 Hours Monday - Wednesday 9 a.m. - 4 p.m. Thursday 9 a.m. - 7 p.m. Friday 9 a.m. - Noon",department_page,https://clintonct.org/149/Building-Department,1.0,0,1
ctc_cec9ee331e4498e5e9ed,ct_clinton,person,Assistant Finance,Finance Director,Finance Director,finance,,Finance,rtait@clintonct.org,direct,8606699465,,"54 E Main Street Clinton, CT 06413 Phone: 860-669-9465 Fax: 860-669-4160 Receive Notifications",,other,https://clintonct.org/151/Finance-Department,1.0,0,1
ctc_ad9fc47c6b27bdf3710b,ct_clinton,role,,First Selectman,First Selectman,chief_executive,,,,unknown,8603991857,,"1587 Boston Post Road in Westbrook, CT and is open to the public We're always looking for more volun",,other,https://reflect-vsctv.cablecast.tv/internetchannel/gallery/31?site=1,0.93,0,1
ctc_6cf7ba6c80e0364fc1f6,ct_clinton,person,Land Use,Land Use Administrative Assistant,Land Use,planning_zoning,Planning,Planning & Zoning,lpascarelli@clintonct.org,direct,,,54 E Main Street,Land Use Office Hours,department_page,https://clintonct.org/161/Planning-Zoning,1.0,0,1
ctc_5f60922780663f7dcc00,ct_clinton,role,,Zoning Enforcement Officer,Planner,planning_zoning,Planning,Planning & Zoning,apiersall@clintonct.org,direct,8606696133,,"54 E Main Street Clinton, CT 06413 Phone: 860-669-6133 Fax: 860-664-4469 Receive Notifications","Create a Website Account - Manage notification subscriptions, save form progress and more. Website Sign In Departments Boards & Commissions Online Services How Do I? Search Plan of Conservation and Development Affordable Housing Plan Application Forms Fence Requirements How to get a Sign Permit Inland Wetlands Property Research Starting a Business in Clinton Figuring out what kind of business and where Subdivision Regulations Planning Documents Town Subdivision Documents Zone Map Zoning Board of Appeals Zoning Enforcement Officer ZEO Reports Zoning Regulations ZEO Events Magazine Articles Stormwater Home Departments Planning & Zoning Planning & Zoning Land Use Hours Land Use Office Hours Mission The Department’s mission is: To enhance the orderly development of the town To maintain the quality of the residential neighborhoods and business districts To Enforce regulations that protect the town from over - development This is accomplished with a service - oriented staff that provides active and consistent enforcement in a fair and equitable manner in order to maintain property values. Staff Functions Staff functions include: Processing applications and permits Providing information to elected members of the Planning and Zoning Commission and Zoning Board of Appeals Providing information on land use issues and zoning regulations to the public on a formal and informal basis The staff is responsible for maintaining a repository of land use information on Clinton properties. Contact Us Abby Piersall, AICP Town Planner Email Kathleen S. Savona, CZEO Zoning Enforcement Officer Email Lori Pascarelli Land Use Administrative Assistant Email Kara Conlon IWC/ZBA Clerk Email Planning & Zoning Physical Address 54 E Main Street Clinton, CT 06413 Phone: 860 - 669 - 6133 Fax: 860 - 664 - 4469 Receive Notifications Tax Payments Town Online GIS Agendas & Minutes Bids Book a Room Contact Us Town of Clinton 54 E Main Street Clinton, CT 06413 Phone: 860 - 669 - 9333 Email Us Quick Links Bid Opportunities Code of Ordinances Zoning Regulations Home Site Map /QuickLinks.aspx Using This Site Home Site Map Accessibility Copyright Notices /QuickLinks.aspx Government Websites by CivicPlus®",department_page,https://clintonct.org/161/Planning-Zoning,1.0,0,1
ctc_aaa39c9b3528babd3cf4,ct_clinton,person,Tax Clerk,Tax Collector,Tax Collector,tax_collector,Tax Clerk Email Tax Collector Physical Address,Tax Collector,rmcnulty@clintonct.org,direct,8606699067,,"54 E Main Street Clinton, CT 06413 Phone: 860-669-9067 Fax: 860-664-9050",,department_page,https://clintonct.org/172/Tax-Department,1.0,0,1
ctc_af4b2754350a8a8ec8cd,ct_clinton,role,,Town Clerk,Town Clerk,town_clerk,Lisa Balter Town Clerk Email,Town Clerk,lbalter@clintonct.gov,direct,8606699101,,"54 E Main Street Clinton, CT 06413 Phone: 860-669-9101 Directory Receive Notifications Tax Paym","Create a Website Account - Manage notification subscriptions, save form progress and more. Website Sign In Departments Boards & Commissions Online Services How Do I? Search Elections Absentee Ballots Election Results Voter Registration Democratic Town Committee Republican Town Committee Justice of the Peace Legal Notices Licenses & Permits Dog Licenses Fish & Game Licenses Massage Therapist Permit Shellfishing Licenses Marriage License Military Discharge Records Records Campaign Finances Freedom of Information / Public Meetings Land Records Maps & Surveys Retention Schedules & Disposal Records Town Meetings Writs, Summons & Complaints Unlawful Restrictive Covenant Forms Services Justices of the Peace Notary Public Other Services Town Charter & Ordinances Vital Records Employee Contracts Trade Name Forms Notice of Application for a Cigarette Dealer Home Departments Town Clerk Town Clerk The Town Clerk's Office will close early on Thursday, April 16, 2026 at 3pm & will be closed for the day on Friday, April 17, 2026 due to required state training for town clerks. Marriage licenses are NOW ISSUED BY APPOINTMENT ONLY Mondays through Wednesday 10:00AM - 2:00PM, Thursday 10:00 AM - 2:00 PM & 4:00 PM - 6:00 PM and Fridays 9:30AM - 11:30AM. Appointments will be made on a first come, first serve basis. To make an appointment, please contact the office as 860 - 669 - 9101 The Town Clerk serves as Clinton's keeper of records for all documents that pertain to the Town and it's residents. This includes, but not limited to, land records, survey maps, Birth certificates, Death certificates, Marriage licenses, dog licenses, and much more. We house and safeguard all of the Town's permanent public records. Records are available 7 days a week, 24 hours a day on the Town Clerk portal. Our online records date back to Book 106, year 1976. https://recordhub.cottsystems.com/ Hours Monday, Tuesday & Wednesday 9:00am - 4:00pm Thursday 9:00am - 7:00pm Friday 9:00am to 12:00pm Closed for lunch from 12:00 PM - 1:00 PM Phone (860) 669 - 9101 Email townclerk@clintonct.org Please note that our office does not accept credit cards We accept cash, check or money order made payable to the Clinton Town Clerk Contact Us Lisa Balter Town Clerk Email Lisa Barbour, CCTC Assistant Town Clerk Email Town Clerk Email Physical Address 54 E Main Street Clinton, CT 06413 Phone: 860 - 669 - 9101 Directory Receive Notifications Tax Payments Town Online GIS Agendas & Minutes Bids Book a Room Contact Us Town of Clinton 54 E Main Street Clinton, CT 06413 Phone: 860 - 669 - 9333 Email Us Quick Links Bid Opportunities Code of Ordinances Zoning Regulations Home Site Map /QuickLinks.aspx Using This Site Home Site Map Accessibility Copyright Notices /QuickLinks.aspx Government Websites by CivicPlus®",department_page,https://clintonct.org/181/Town-Clerk,1.0,0,1
ctc_e8f886204ad6ae8f8d04,ct_clinton,role,,Town Manager,Town Manager,chief_executive,,Town Manager,mbenivegna@clintonct.org,direct,8606699333,,"54 East Main Street Clinton, CT 06413 Phone: 860-669-9333 Fax: 860-669-0890 Receive Notifications",,other,https://clintonct.org/263/Town-Managers-Office,1.0,0,1
ctc_4093158450b949d53e91,ct_clinton,role,,Town Treasurer,Treasurer,finance,,Finance,,unknown,8606641130,,54 E Main Street,Town of Clinton Hours and Holidays,staff_directory,https://clintonct.org/Directory.aspx,0.77,0,1
ctc_3c70135da6076ceab69c,ct_columbia,role,,Assessor,Assessor,assessor,Tax Collector,Tax Collector,taxcollector@columbiact.gov,role_based,8602289555,,,"Tax Collector Please be advised that there has been a change in the way USPS postmarks your mail. Same - day postmarks are no longer guaranteed unless the item is taken to a post office counter. If you have time sensitive items with a deadline date, bring them directly to the post office and request a manual postmark. As a reminder the second installment of the Real Estate, Personal Property and the Supplemental Motor Vehicle taxes are due on January 1, 2026. The last day to pay without a penalty is February 2, 2026. If taxes are not paid on or before February 2, 2026, interest will be charged at the rate of 1½% per month (18% per year) from the due date of January 1st. The minimum interest charged is $2.00. Failure to receive a bill does not invalidate the tax or interest per CT State Statute . Bills are not sent for this second installment. The Tax Office has extended hours during the tax collection month of January2026 : Monday through Wednesday 8:00 - 4:00, Thursday 8:00 - 6:00 and Friday 8:00 - 12:00. Mailing address for tax payments: Town of Columbia Dept # 347 PO Box 150512 Hartford, CT 06115 - 0512 Drop boxes for payments and correspondence are located at the right side of the entrance of the Town Hall and in front of Yeoman’s Hall. The drop boxes are emptied at 8:00AM each weekday, weekend tax payments are processed on Monday. Please be aware that tax payments put in the drop box after 8:00AM will be processed the next day the Tax Office is open. You can view and pay taxes online. Service fees for tax payments are, .95 cents to use a bank account and 2.99% for credit and debit cards. General Information The Tax Collector is responsible for the overall administration of the Town’s revenue collection function. Plans and directs the Town’s tax billing and collection strategy in accordance with Connecticut General Statutes, Town Charter and ordinances. The Tax Collector supervises the collection of real estate, personal property and motor vehicle taxes. The Assessor is responsible for the amount of your bill. The Tax Collector is responsible for the collection of that bill. If you have any questions regarding the assessment of your property please call the Assessor at 860 - 228 - 9555. Regular office hours are Monday, Tuesday, Wednesday from 8:00 am to 4:00 pm, Thursday from 8:00 am to 6:00 pm and CLOSED Friday. Office hours in July and January are Monday, Tuesday, Wednesday from 8:00 am to 4:00 pm, Thursday from 8:00 am to 6:00 pm and Friday 8:00 to 12:00. The office is located in the Town Hall 323 Route 87, Columbia, CT 06237. If the Town Hall is closed, you may use the drop box on the right side of the front door or the drop box in front of Yeomans Hall. TAX BILLS NEW TAX BILLS WILL BE MAILED OUT FROM WATERBURY ON THURSDAY JUNE 26TH. THEY WILL BE AVAILABLE FOR VIEWING AND PAYING ONLINE ON TUESDAY JULY 1ST. The last day to pay the July tax bill is August 1, 2025. PAYMENT OPTIONS Payments may be mailed by using the envelope enclosed in your tax bill to TOWN OF COLUMBIA, DEPT. #347, P.O. BOX 150512, HARTFORD, CT 06115 - 0512. (323 Route 87, Columbia, CT 06237), or put in one of the drop boxes in front of the Town Hall. You may also pay online. COLUMBIACT.GOV Fees for online payments are .95 cents to use a Bank account (enter your routing and account number) or 2.99% to use a credit or debit card. Please review the information provided below: The Town of Columbia is under contract with TaxServ Capital Services for the collection of the town’s delinquent motor vehicle and personal property taxes (Grand List years 2021 and prior). If you receive a letter from TaxServ, you must call TaxServ to discuss your account and arrange payment. Telephone: 860 - 724 - 9100 Toll Free: 866 - 497 - 2427 Fax: 860 - 727 - 1080 The following is contact information for the Tax Collector: Email taxcollector [at] columbiact.org ( taxcollector[at]columbiact[dot]gov ) Office Phone 860 - 228 - 0230 Office Fax 860 - 228 - 2335 For information on tax sales visit http ://cttaxsales.com/upcoming - tax - sales/ View PDF of Page Tax Collector Online Payments Questions and Answers Pay Taxes Online Tax Collector Tax Questions and Answers Janice Clauson Tax Collector (860) 228 - 0230 Email View All Listings Contact Information Phone Number 860 - 228 - 0230 Email Contact Group Office Hours Monday - Wednesday: 8:00am to 4:00pm Thursday: 8:00am to 6:00pm CLOSED ON FRIDAYS Extended hours July & January Monday - Wednesday: 8:00am to 4:00pm Thursday: 8:00am to 6:00pm Friday: 8:00am to 12 noon Address Columbia Town Hall 323 Route 87 Columbia, CT 06237",department_page,https://www.columbiact.gov/tax-collector,1.0,0,1
ctc_3638e50483485d1550f2,ct_columbia,person,Jason Nowosad,Building Official,Building Official,building,Building Official,Building,,unknown,8602280440,115,,Office Hours,department_page,https://www.columbiact.gov/building-land-use,1.0,0,1
ctc_33829e79c19efdbed52b,ct_columbia,person,Beverly Ciurylo,Finance Director & Treasurer,Finance Director,finance,"860-228-8423 ext.1 (external calls only) For internal calls, use ext 104","860-228-8423 ext.1 (external calls only) For internal calls, use ext 104",bciurylo@columbiact.gov,direct,8602288423,1,,"Toggle Navigation Town of Columbia Connecticut Close Navigation Header Links Home Contact Us Main navigation Departments Animal Control Assessor Building & Land Use Community Social Services Emergency Management Facilities Management Finance Fire Marshal First Selectman Inland Wetlands Planning & Zoning Public Works Recreation Registrar of Voters Senior Services Tax Collector Town Administrator Town Clerk Your Government Agendas & Minutes Boards and Commissions Legal Notices Our Community Columbia Views News Pay Taxes Online Service Providers Columbia Town Beach Weather GIS Parcel Viewer Monthly Newsletter America 250 Columbia Committee Visitors Information Forms and Permits How Do I? Search Departments & Committees Type Event Date Breadcrumb Home Toggle Menu Finance The Finance Department provides financial and accounting services to the Board of Selectmen and the Board of Education. The department consists of a Finance Director who also serves as the Town Treasurer, an Accounting Assistant and Payroll Specialist. The services provided by the Finance Department include processing and monitoring all Town and Board of Education revenue and expenditures, budget preparation and monitoring, maintaining all cash accounts, reconciling accounts, preparing the annual report and overseeing the annual audit. Title Name Email Office Phone Office Fax Finance Director & Treasurer Beverly Ciurylo bciurylo [at] columbiact.org (bciurylo[at]columbiact[dot]gov) 860 - 228 - 8423 ext.1 (external calls only) For internal calls, use ext 104 860 - 228 - 2392 Accounting Assistant Kara Bowen kbowen [at] columbiact.gov (kbowen[at]columbiact[dot]gov) 860 - 228 - 8423 ext. 2 (external calls only) For internal calls, use ext 110 860 - 228 - 2392 Payroll Specialist Position Vacant TBD 860 - 228 - 8423 ext. 3 (external calls only) For internal calls, use ext. 109 860 - 228 - 2392 Supporting Documents PROPOSED FY 2026 - 2027 TOWN & BOE BUDGETS 1.48 MB Summary of PROPOSED FY 2026 - 2027 BUDGET 45.98 KB fy_24 - 25_adopted_town_of_columbia_budget_.pdf 1.3 MB mill_rate_without_state_revenue_2024 - 2025.pdf 39.81 KB View PDF of Page Finance Approved BOS & BOE Budgets Audit Reports Beverly Ciurylo Finance Director (860) 228 - 8423 ext. 104 Email Kara Bowen Accounting Assistant (860) 228 - 8423 ext. 110 Email Vacant Vacant Payroll Specialist (860) 228 - 8423 ext. 109 View All Listings Contact Information Phone Number 860 - 228 - 8423 Office Hours Mon - Thur 8 - 4, Fri 8 - 12 Address Columbia Town Hall 323 Route 87 Columbia, CT 06237 Utility Links Menu Home Staff Login Accessibility Columbia Town Hall, 323 Route 87 | Columbia, CT 06237 | (860) 228‑0110 Government Websites by CivicPlus®",homepage,https://www.columbiact.gov/finance,1.0,0,1
ctc_46410945b69338275bcf,ct_columbia,person,Steven Everett,First Selectman,First Selectman,chief_executive,,,,unknown,8602280110,101,,"Generally, Town Hall office hours are: M - W 8 - 4, Th 8 - 6, F 8 - 12.",homepage,https://www.columbiact.gov/contact-us,1.0,0,1
ctc_e5f64602972c21ec6518,ct_columbia,role,,Planner,Planner,planning_zoning,Planning,Planning & Zoning,jguszkowski@columbiact.gov,direct,8602280440,,,"Planning and Zoning Planning PLEASE SCROLL DOWN FOR SUPPORTING DOCUMENTS Columbia's Town Planner is John Guszkowski . John informs applicants of the Planning and Zoning Commission's (PZC) application process and serves the PZC in many ways, including providing research and professional advice. Below is contact information regarding Planning: Office Hours Tuesday and Thursday by appointment Email jguszkowski [at] columbiact.org (subject: Planning%20%26%20Zoning%20Question) (jguszkowski[at]columbiact[dot]gov) Office Phone 860 - 228 - 0440 Zoning Savannah Kitchin is Columbia's Zoning Enforcement/Blight Officer. Below is contact information concerning zoning/blight issues. Office Hours Mon - Thurs by appointment Office Phone 860 - 228 - 0440 Email zeo [at] columbiact.org ( zeo @columbiact.gov) Supporting Documents 4 - 27 - 26 Public Hearing Proposed Columbia Zoning Regulation Amendments 288.63 KB Columbia 2026 Draft Plan of Conservation & Development 3.37 MB PZC Site Plan Application 54.85 KB PZC Special Permit Application 117.91 KB PZC Subdivision Application 165.04 KB PZC Zone Change or Regulation Amendment Application 50.13 KB ZBA Special Permit Application 158.74 KB Zoning Regulations - Effective 7 - 1 - 25 946.72 KB PZC Bylaws - Effective 04 - 13 - 26 312.93 KB View PDF of Page Planning and Zoning Columbia Lake Protection Requirements Sign Application Subdivision Regulations Town Review of Lot Line Adjustments and Lot Splits Zoning Regulations and Map Accessory Dwelling Unit Contact Information Phone Number Building & Land Use Phone: 860 - 228 - 0440 Office Hours Generally, Town Hall office hours are: M - W 8 - 4, Th 8 - 6, F 8 - 12. Address Columbia Town Hall 323 Route 87 Columbia, CT 06237",department_page,https://www.columbiact.gov/planning-zoning,1.0,0,1
ctc_49ec3b4ac46ef8f70586,ct_columbia,department_contact,Fax Number,,Tax Collector,tax_collector,Tax Collector,Tax Collector,,unknown,8602282335,,,Extended hours July & January Monday - Wednesday: 8:00am to 4:00pm Thursday: 8:00am to 6:00pm Friday: 8:00am to 12 noon,staff_directory,https://www.columbiact.gov/tax-collector/directory-listing/janice-clauson,1.0,0,1
