contact_id,municipality_id,entity_type,name,title,role_normalized,role_family,department,department_normalized,email,email_type,phone,phone_ext,address,hours,page_type,source_url,display_confidence,is_likely_noise,rn
ctc_9a5ee43fc91f2ff98572,ct_danbury,role,,Laurie A. Esposito Town Clerk Email Laurie Esposito Phone: 203-797-4531,Town Clerk,town_clerk,Laurie A. Esposito Town Clerk Email Laurie Esposito Phone,Town Clerk,l.esposito@danbury-ct.gov,unknown,2037974531,,"155 Deer Hill Avenue Danbury, CT 06810 How do I get married in the City of Danbury? Requirements to","Home Government Departments Town Clerk Town Clerk How can I obtain a copy of a LAND RECORD? You may obtain a copy of a Land Record at the Town Clerk's Office for $1 per page or by logging into RecordHub from your home for a fee. View the RecordHub Land Records . How do I obtain a copy of a birth, marriage or death certificate? You may obtain a copy of a birth, marriage, or death certificate at the Town Clerk’s Office. You must bring your valid government - issued photo ID (i.e. Driver’s License or Passport) along with a completed application. Certificates are payable by cash or check payable to the City of Danbury. The fee is $20 per certificate. Credit cards are not accepted. These certificates may also be requested by mail. Please download and fill out a birth certificate application, marriage certificate application, or death certificate application . Please make sure to mail the completed request with the following requirements: ⁬ Check or money order made payable to the City of Danbury. Include a photocopy of your valid government issued photo ID (i.e. Driver’s License or Passport). ⁬ Mail application and a self - addressed stamped envelope to: Town Clerk's Office City of Danbury 155 Deer Hill Avenue Danbury, CT 06810 How do I get married in the City of Danbury? Requirements to Obtain a License in Connecticut A marriage license is required by the Marriage Laws of the State of Connecticut. You must apply in the Town where the ceremony will be performed. AN APPOINTMENT IS NECESSARY to apply for a marriage license in Danbury, so after you complete the Online Marriage License Application AND have made arrangements with your Officiant, call for an appointment at (203) 797 - 4531 (a couple of weeks in advance of your wedding date is recommended because the schedule fills up quickly ) . Marriage licenses are issued between 9 am to 5 pm. Monday through Thursday by appointment onl y . If you do not speak ENGLISH, you MUST bring an interpreter/translator. Si no habla INGLÉS, DEBE traer un intérprete/traductor. The online marriage license application must be completed prior to making the appointment and coming into the Town Clerk's Office to obtain your license. Both parties must appear together in person. You must have a date selected. You must have the officiant arranged, bring with your their contact information to include Name and Phone Number. If officiant is Ordained, please provide a copy of their certificate. The Town Clerk does not perform marriage ceremonies. You must bring a valid government - issued photo ID (i.e. Driver's License or Passport) The license will only be valid for 65 days from the date the license is issued. No exception is allowed. If the license is not used in this time period, you MUST begin the process over and reapply. You can only apply in the town where the marriage is taking place. Age Requirements Applicants must be 18 years of age or over to marry in Connecticut. Exact Name A full legal name is required, using your legal name at the time of the application. No abbreviations, nicknames, or initials. The information for the marriage license should appear as it does on your birth certificate, unless you changed your name legally in a previous marriage then that is your legal name unless your divorce decree reverses it, or you had a court - ordered name change. Fees The fee for a marriage license is $50 payable by cash or check. An additional $20 will be charged for a certified copy of your marriage certificate which will be mailed to you once your license is returned to our office by the officiant after the ceremony is performed. Additional certified copies can be requested for a $20 per copy fee. Civil Ceremony For couples choosing to have a Justice of the Peace perform their ceremony, you may contact a Justice of the Peace from the list provided to make arrangements. The Town Clerk does not perform marriage ceremonies. Connecticut Residents Marrying in Another State Not all states have the same requirements. Contact the state in which the marriage ceremony is being performed. How do I obtain a copy of my divorce papers? Regardless of where you were married, the court district for the area where you were residing at the time of your divorce will have those papers. If you were divorced at the Danbury Superior Court, you may contact the Court Clerk at 203 - 207 - 8600. Where do I obtain a hunting and/or fishing license? You may obtain a hunting and fishing license in person at the Town Clerk's Office or through the CT DEEP . Reservoir permits can be obtained by Danbury residents in the Town Clerk's Office by providing your name, address, and conservation number. How do I obtain a dog license? Pursuant to Connecticut General Statute 22 - 338, all dogs over the age of six months of age must be vaccinated for rabies and licensed during the month of June. The licensing fee is $8 for spayed/neutered dogs and $19 for male/female (unaltered) dogs. If you are licensing for the first time, it will be necessary for you to provide your name, address, phone number, name of dog, breed, age, and color. You will also be required to provide proof of current rabies vaccination and proof of your dog being neutered or spayed from your veterinarian. Dog License Application If this is a renewal, you will need to provide documentation of current rabies vaccination if it is noted on your renewal that your vaccination has expired. Annual licenses must be obtained during the period of June 1st through June 30th. Beginning July 1st, a $1 per month late fee will be charged for each month you fail to license your dog. If you are renewing by mail, send your renewal and a check payable to the City of Danbury along with a stamped, self - addressed envelope to: Town Clerk's Office City of Danbury 155 Deer Hill Avenue Danbury, CT 06810 How do I obtain or CANCEL a trade name certificate? You may obtain or terminate a trade name certificate at the Town Clerk's Office. You must fill out an application to obtain a new trade name for a Business Organization or for Natural Persons or Trade Name Application Addendum to cancel a trade name . To amend a trade name, please fill out a new trade name form and check ""Amendment"". There is a $20 fee for each form to file. Trade names will expire 5 years from original filing date. Town Clerk Forms Absentee Ballot Application (2026) (PDF) Birth - Uncertified Adopted Request (PDF) Birth Certificate Request (PDF) Death Certificate Request (PDF) Dog License Application (PDF) Justice of the Peace List (PDF) Marriage Certificate Request (PDF) Trade Name Certificate Business Organization Application (PDF) Trade Name Certificate Natural Persons Application (PDF) Trade Name Application Addendum (PDF) Trade Name Cancellation (PDF) About Us The Town Clerk is responsible for the preservation and safekeeping of all official records and documents for the City of Danbury. The various duties and function of the Town Clerk are defined by Connecticut State Statutes and the City Charter. The Town Clerk is considered the government official in charges of public records, vital statistics and plays a key role in the election process. As the Registrar of Vital Statistics, the Town Clerk has oversight of all births, marriages and deaths which occur and are recorded in the City of Danbury. The Town Clerk serves as the official keeper of the City Seal. Our staff provides guidance and assistance to our residents, attorneys, title searchers, local businesses and state agencies. What Our Office Does to Serve You Public Records Maintains and provides access to public records as required by state law Provides certified copies of public records Records, indexes, and preserves municipal land records, surveys and maps Posts meeting notices for local government bodies Maintains official records of charters, ordinances, appointments and petitions Maintains public meeting agendas, minutes and notices Records trade names and military discharges Issues certificates of authority to Justices of the Peace and notary publics Maintains official copies of town budgets, audits and annual reports Vital Statistics Registers, corrects, amends and maintains original birth, marriage and death records Issues certified copies of vital statistic records Assists with genealogical research for certified genealogists Licensing Issues state marriage, liquor, hunting, fishing and dog licenses Issues burial, cremation and removal permits Issues permits for food trucks Elections Acts as a filing repository for municipal office candidates' campaign finance reports Certifies nominating petitions Issues absentee ballot applications Files Legal Notices for primaries and elections Our Accomplishments 2024 - 25: The Town Clerk's office has made significant progress in preserving, maintaining, and accessing our most valuable records from both the past and present. Major accomplishments for Fiscal Year 2024 / 2025 have included: Successfully managed increased marriage licenses due to the influx from the tri - state area of multiple, simultaneous applicants by implementing processed to make the office more efficient. Supported the Registrar of Voters during Connecticut's first Early Voting process. Staff attended and obtained certificates for NARCAN training per recommendation of Cyber Security and Infrastructure Security Agency. Contact Us Laurie A. Esposito Town Clerk Email Laurie Esposito Phone: 203 - 797 - 4531 Town Clerk Hours Monday through Wednesday 7:30 am to 6 pm Thursday 7:30 am to 6:30 pm Closed Friday Through Sunday Recordings are accepted until 5 pm Marriage Licenses are now issued by appointment only Monday - Thursday between 9 am to 5 pm Directory PropertyCheck If you would like free notifications of activity on Danbury's Land Records, please register for PropertyCheck. PropertyCheck Flyer (PDF) Quick Links Search Land Records on RecordHub Voter information Updated Requirements for Ice Cream Trucks /QuickLinks.aspx Town Clerk Fees Updated Fees (PDF) Town Clerk Fees (PDF) Notice of Application for a Cigarette Dealer Retailer License The applicants below have applied for a Cigarette Dealer/Retail License. By law, a copy of their notice of application must be posted and maintained on the website of the municipality for at least a two - week period. 01 - 06 - 26 RRDA LLC (PDF) 01 - 27 - 26 SL 20 Backus Avenue LLC (PDF) 04 - 09 - 26 PRAMUKH 71 INC PDF)",department_page,https://www.danbury-ct.gov/265/Town-Clerk,1.0,0,1
ctc_5e6329adda7fdc3e8030,ct_danbury,role,,Treasurer,Treasurer,finance,"Coffey, Bill Treasurer",Finance,,unknown,2037461439,,19 New Street Danbury CT 06810,City Hall Hours Monday - Wednesday 7:30AM to 6:00PM Thursday,staff_directory,https://www.danbury-ct.gov/Directory.aspx?did=16,1.0,0,1
ctc_0af5c49f332aa0d63e6e,ct_enfield,role,,Assessor,Assessor,assessor,Assessor,Assessor,assessor@enfield.org,role_based,8602536339,,1 Street and January 1 Street All bills are mailed the last week of June with enough copies for each installment Real Estate taxes cover from July 1 Street of the current year through June 30 th of the following year To ensure you rec,"EMERGENCY ALERT Building Inspection and Planning & Zoning Departments Read On... Create a Website Account - Manage notification subscriptions, save form progress and more. Website Sign In Services Departments Community Government ARPA Search Home FAQ All categories Snow Removal Sewer Billing Sewer Use Fee Magic Carpet Bus Service EHSB Committee Engineering Police Department Finance Human Resources Fire Department, Enfield Fire District No.1 Assessment and Revenue Collection Emergency Medical Services Town Clerk Fleet Maintenance Town Manager Building Inspection Registrar of Voters Neighborhood Services Assessor - Revaluation Frequently Asked Questions Below you will find information that might help you understand how to find things or learn about information you might need to know about your city or town. Assessment and Revenue Collection 4 All Content What should I do if I got rid of a vehicle? Do not ignore your bill. Please provide the Assessor with the proper documentation for an adjustment to your motor vehicle assessment. Assessment and Revenue Collection How do I view the Assessor Database? Please refer to Vision Government Solutions Website / . Assessment and Revenue Collection How do I view and pay my taxes? Please visit our Tax Payment Portal to view and pay your taxes. Assessment and Revenue Collection When will I receive my tax bills and when will they be due? Real Estate Taxes over $100 are due in two installments, on July 1 st and January 1 st . All bills are mailed the last week of June with enough copies for each installment. Real Estate taxes cover from July 1 st of the current year through June 30 th of the following year. To ensure you receive a copy of your bill, your mailing address must be updated with the Assessor's office at (860) 253 - 6339 or by email at assessor@enfield.org . Note: No bill will be mailed for the January installment. when you purchase a new property. when you change mailing addresses. If you have paid off your mortgage, contact the tax office at (860) 253 - 6340 or by email taxcollector@enfield.org . Personal Property Taxes over $100 are due in two installments, on July 1 st and January 1 st . All bills are mailed the last week of June with enough copies for each installment. Personal Property taxes cover a business that was operating on October 1 st of the previous year. To ensure you receive a copy of your bill, your mailing address must be updated with the Assessor's office at (860) 253 - 6339 or by email at assessor@enfield.org . Note: No bill will be mailed for the January installment. Regular Motor Vehicle Taxes are due in one installment on July 1 st . Bills are mailed for any vehicle registered in Enfield as of October 1 st of the previous year. Motor Vehicle taxes cover from October 1 st of the previous year through September 30 th of the following year. To ensure you receive a copy of your bill, your mailing address must be updated with the Department of Motor Vehicles and the Post Office. Supplemental Motor Vehicle Taxes are due in one installment on January 1 st . Bills are mailed for any vehicle registered in Enfield between October 2 nd and September 30 th of the following year. To ensure you receive a copy of your bill, your mailing address must be updated with the Department of Motor Vehicles and the Post Office. REMINDER: NO SECOND BILL WILL BE SENT. The July bills for the Real Estate and Personal Property taxes have 3 parts. Part C is for the taxpayer’s records for both payments (which can be stamped by the office when paid). Part B is for the January 1st installment, and Part A is for the July 1st installment. Warning: Electronic bill pay services may not mail your payment when you expect them to! You use these services at your own risk. These payments come to us WITHOUT POSTMARK and must be RECEIVED BY US before the last day to pay in order to be considered timely. Please read the instructions and warnings provided by your own bank before using it! Assessment and Revenue Collection Assessment and Revenue Collection 4 What should I do if I got rid of a vehicle? How do I view the Assessor Database? How do I view and pay my taxes? When will I receive my tax bills and when will they be due? Online Services Agendas & Minutes Stay Connected Maps & Property Info Report a Concern Employment Contact Us Enfield Town Hall | 820 Enfield Street, Enfield, CT 06082 - 2997 Hours: Monday - Friday | 9:00 a.m. - 5:00 p.m. Phone: (860) 253 - 6300 Quick Links Home Site Map Accessibility Copyright Notices /QuickLinks.aspx Home Site Map Accessibility Copyright Notices /QuickLinks.aspx Government Websites by CivicPlus®",other,https://www.enfield-ct.gov/m/faq?cat=28,1.0,0,1
ctc_0a65dc03bb55f5fbb5f6,ct_enfield,role,,building official,Building Official,building,,Building,,unknown,8602536300,,"820 Enfield Street, Enfield, CT 06082-2997 Hours: Monday - Friday | 9:00 a.m - 5:00 p.m Phone: (","EMERGENCY ALERT Building Inspection and Planning & Zoning Departments Read On... Create a Website Account - Manage notification subscriptions, save form progress and more. Website Sign In Services Departments Community Government ARPA Search Vacancies/Reappointments Agricultural Commission Aquifer Protection Agency Area Cable Television Advisory Committee Athletic Hall of Fame Committee Blight Review Committee Board of Assessment Appeals Board of Education Building Code Board of Appeals Charter Revision Commission Commission on Aging Connecticut Water Company Advisory Council Conservation Commission Economic Development Commission Enfield Culture and Arts Commission Enfield Beautification Committee Areas Open for Adoption Beautification Committee Flag Project Enfield Clean Sweep Ethics Commission Fair Rent Commission Historic District Commission Inland Wetlands & Watercourses Agency JFK Building Committee Joint Facilities Committee Library Board of Trustees Loan Review Committee North Central District Health Department Patriot Award Committee Planning & Zoning Commission Prison / Town Liaison Committee Tax Increment Financing Advisory Committee Town Council Adopted Budgets Town Council Priorities, Goals & Objectives Economic Development Education Infrastructure & Facilities Public Safety Quality of Life Town Charter FY 2027 Budget Water Pollution Control Authority Zoning Board of Appeals Home Government Boards, Committees & Commissions Building Code Board of Appeals Building Code Board of Appeals Regulations A board of appeals shall be appointed by each municipality. Such board shall consist of five members, all of whom shall meet the qualifications set forth in the State Building Code. A member of a board of appeals of one municipality may also be a member of the board of appeals of another municipality (C.G.S. 29 - 266(a)). One member of the board of appeals shall be appointed from the general public. The other four members shall have at least five years experience each in building design, building construction, or supervision of building construction (C.S.B.C. 112.2.1 amd). The board shall annually select one of its members to serve as chairman (C.S.B.C. 112.2.2 amd). Each appeal shall be heard in the municipality for which the building official serves within five days, exclusive of Saturdays, Sundays, and legal holidays, after the date of receipt of the appeal (C.S.B.C. 112.3 amd). Source : Connecticut General Statutes (C.G.S.) and the 1999 Connecticut State Building Code (C.S.B.C.). Online Services Agendas & Minutes Stay Connected Maps & Property Info Report a Concern Employment Contact Us Enfield Town Hall | 820 Enfield Street, Enfield, CT 06082 - 2997 Hours: Monday - Friday | 9:00 a.m. - 5:00 p.m. Phone: (860) 253 - 6300 Quick Links Home Site Map Accessibility Copyright Notices /QuickLinks.aspx Home Site Map Accessibility Copyright Notices /QuickLinks.aspx Government Websites by CivicPlus®",department_page,https://www.enfield-ct.gov/716/Building-Code-Board-of-Appeals,0.9900000000000001,0,1
ctc_73a07d4fe58cc743708b,ct_enfield,role,,mayor,Mayor,chief_executive,Zoning,Planning & Zoning,,unknown,8602536300,,5 of the CT general statutes The responsibility of the board is to hear and decide appeals,"EMERGENCY ALERT Building Inspection and Planning & Zoning Departments Read On... Create a Website Account - Manage notification subscriptions, save form progress and more. Website Sign In Services Departments Community Government ARPA Search Vacancies/Reappointments Agricultural Commission Aquifer Protection Agency Area Cable Television Advisory Committee Athletic Hall of Fame Committee Blight Review Committee Board of Assessment Appeals Board of Education Building Code Board of Appeals Charter Revision Commission Commission on Aging Connecticut Water Company Advisory Council Conservation Commission Economic Development Commission Enfield Culture and Arts Commission Enfield Beautification Committee Areas Open for Adoption Beautification Committee Flag Project Enfield Clean Sweep Ethics Commission Fair Rent Commission Historic District Commission Inland Wetlands & Watercourses Agency JFK Building Committee Joint Facilities Committee Library Board of Trustees Loan Review Committee North Central District Health Department Patriot Award Committee Planning & Zoning Commission Prison / Town Liaison Committee Tax Increment Financing Advisory Committee Town Council Adopted Budgets Town Council Priorities, Goals & Objectives Economic Development Education Infrastructure & Facilities Public Safety Quality of Life Town Charter FY 2027 Budget Water Pollution Control Authority Zoning Board of Appeals Home Government Boards, Committees & Commissions Zoning Board of Appeals Zoning Board of Appeals Superior Court Hearing Notice Docket No. HHD - CV - 21 - 6143003 - S and HHD - CV - 24 - 6186717 - S. Click here for details. ZBA 12/15/25 Legal Action Ad. The next regular meeting is scheduled on April 27, 2026. Fourth Monday of each month *Third Monday in May and December to observe holiday Agendas & Minutes All application materials are available for public view in the Planning Department. Meeting Materials - Civic Clerk Link to Agenda and Master Packet YouTube Link: https://www.youtube.com/user/EnfieldTelevision ~~~~~~~~~~~~~~~~~~~~~~~~~~~~~~~~~~~~~~~~~~~~~~~~~~~~~~~~~~~~~~~~~~~~~~ Missed the meeting? No worries! Click this link to Civic Clerk to view previous agendas and minutes. ~~~~~~~~~~~~~~~~~~~~~~~~~~~~~~~~~~~~~~~~~~~~~~~~~~~~~~~~~~~~~~~~~~~~~~ Members There are 8 persons appointed by the mayor with consent of the council. The committee is also staffed by: 5 regular resident members, 4 year term no more than 3 of these members may be of the same political party 3 alternate resident members, 4 year term no more than 2 of these members may be of the same political party Commission Members Information Link Done Editing No member of the planning and zoning commission shall be eligible for appointment to the zoning board of appeals as a regular or an alternate member. Zoning Board of Appeals Bylaws Committee Goals The Zoning Board of Appeals was created in accordance with Title 8, Chapter 124, Section 8 - 5 of the CT general statutes. The responsibility of the board is to hear and decide appeals where it is alleged that there is an error in any order, requirement or decision made by the official charged with the enforcement of chapter 124 or any bylaw, ordinance or regulation adopted under the provisions of this chapter and to hear and decide all matters including special exceptions and special exemptions under section 8 - 2g upon which it is required to pass by the specific terms of the zoning bylaws, ordinance or regulations in harmony with their general purpose and intent and with the due consideration for conserving the public health, safety, convenience, welfare and property values solely with respect to a particular parcel of land. Online Services Agendas & Minutes Stay Connected Maps & Property Info Report a Concern Employment Contact Us Enfield Town Hall | 820 Enfield Street, Enfield, CT 06082 - 2997 Hours: Monday - Friday | 9:00 a.m. - 5:00 p.m. Phone: (860) 253 - 6300 Quick Links Home Site Map Accessibility Copyright Notices /QuickLinks.aspx Home Site Map Accessibility Copyright Notices /QuickLinks.aspx Government Websites by CivicPlus®",department_page,https://www.enfield-ct.gov/711/Zoning-Board-of-Appeals,1.0,0,1
ctc_d5dc9bd84a65c365a98e,ct_enfield,person,Historic District,,Planner,planning_zoning,Planning,Planning & Zoning,planningzoningservice@enfield.org,role_based,8602536355,,810 Enfield Street,Hours: Monday - Friday | 9:00 a.m. - 5:00 p.m.,department_page,https://www.enfield-ct.gov/153/Planning-Zoning,1.0,0,1
ctc_2f5c90bbe71f9cd96a7d,ct_enfield,role,,Tax Collector,Tax Collector,tax_collector,Tax Collector's Office,Tax Collector,taxcollector@enfield.org,role_based,8602536340,,"800 Enfield Street Enfield, CT 06082 Mailing Address 820 Enfield Street Enfield, CT 06082 Phone:","Contact Us Tax Collector Email the Tax Collector's Office Physical Address 800 Enfield Street Enfield, CT 06082 Mailing Address 820 Enfield Street Enfield, CT 06082 Phone: 860 - 253 - 6340 Hours Monday through Friday 9 a.m. to 5 p.m. Directory Revenue Collection Tax Calculator FY 2026 Correcting Clerical Mistakes and Obtaining Tax Refunds Motor Vehicles Property Tax Exemptions, Abatements and Credits Waiver of Taxes or Interest Taxe s Town Lowers Interest Rate Covid - 19 Lookup and payment portal Tax Sale 2025 TBD Properties & Procedures",department_page,https://www.enfield-ct.gov/170/Tax-Collectors-Office,1.0,0,1
ctc_302b7b124211336fdb42,ct_enfield,role,,Town Clerk,Town Clerk,town_clerk,Sheila M Bailey Town Clerk Email,Town Clerk,sbailey@enfield.org,direct,8602536440,,"820 Enfield Street Enfield, CT 06082 Phone: 860-253-6440 Hours Monday - Friday 9 a.m - 5 p.m D","Contact Us Sheila M Bailey Town Clerk Email Physical Address 820 Enfield St. Enfield, CT 06082 Phone: 860 - 253 - 6440 Hours Monday - Friday 9 a.m. - 5 p.m. Directory",department_page,https://www.enfield-ct.gov/415/Town-Clerk,1.0,0,1
